[
  {
    "classified_id": "CLS-001",
    "evidence_id": "EV-001",
    "source_section": "Section 2.1 - Enhanced Due Diligence for High-Risk Clients",
    "page_estimate": 1,
    "text": "Financial institutions must complete enhanced due diligence for all high-risk clients within 30 days of onboarding.",
    "change_type": "new_requirement",
    "content_hash": "cd3d01c71c20"
  },
  {
    "classified_id": "CLS-002",
    "evidence_id": "EV-001",
    "source_section": "Section 2.1 - Enhanced Due Diligence for High-Risk Clients",
    "page_estimate": 1,
    "text": "Failure to comply will result in penalties of up to EUR 10 million or 10% of annual turnover.",
    "change_type": "general",
    "content_hash": "da3e3e91dc79"
  },
  {
    "classified_id": "CLS-003",
    "evidence_id": "EV-002",
    "source_section": "Section 3.4 - Real-Time Transaction Monitoring",
    "page_estimate": 1,
    "text": "Institutions must implement real-time transaction monitoring systems capable of flagging suspicious activity within 60 seconds.",
    "change_type": "new_requirement",
    "content_hash": "55ede71e3f3d"
  },
  {
    "classified_id": "CLS-004",
    "evidence_id": "EV-002",
    "source_section": "Section 3.4 - Real-Time Transaction Monitoring",
    "page_estimate": 1,
    "text": "Non-compliance sanctions may reach EUR 5 million per breach.",
    "change_type": "general",
    "content_hash": "f72b2de8c1b4"
  },
  {
    "classified_id": "CLS-005",
    "evidence_id": "EV-003",
    "source_section": "Section 4.7 - Beneficial Ownership Verification",
    "page_estimate": 1,
    "text": "Institutions must verify and record beneficial ownership for all corporate clients within 14 days.",
    "change_type": "new_requirement",
    "content_hash": "d9ea8fc0bec7"
  },
  {
    "classified_id": "CLS-006",
    "evidence_id": "EV-003",
    "source_section": "Section 4.7 - Beneficial Ownership Verification",
    "page_estimate": 1,
    "text": "Violations are subject to enforcement action and licence suspension.",
    "change_type": "general",
    "content_hash": "aa4b4356b8c0"
  },
  {
    "classified_id": "CLS-007",
    "evidence_id": "EV-004",
    "source_section": "Section 5.2 - Suspicious Activity Reporting",
    "page_estimate": 1,
    "text": "Compliance teams must file suspicious activity reports within 24 hours of detection.",
    "change_type": "new_requirement",
    "content_hash": "7a7084869fea"
  },
  {
    "classified_id": "CLS-008",
    "evidence_id": "EV-004",
    "source_section": "Section 5.2 - Suspicious Activity Reporting",
    "page_estimate": 1,
    "text": "Breach of this requirement constitutes a regulatory violation liable to fines and remediation orders.",
    "change_type": "general",
    "content_hash": "859e5942ac53"
  },
  {
    "classified_id": "CLS-009",
    "evidence_id": "EV-005",
    "source_section": "Section 6.1 - Staff Training and Certification",
    "page_estimate": 1,
    "text": "All compliance staff must complete AML certification training every 6 months.",
    "change_type": "new_requirement",
    "content_hash": "f2233395eca7"
  },
  {
    "classified_id": "CLS-010",
    "evidence_id": "EV-005",
    "source_section": "Section 6.1 - Staff Training and Certification",
    "page_estimate": 1,
    "text": "Non-compliance with training obligations may result in regulatory sanctions against the institution.",
    "change_type": "general",
    "content_hash": "8d6f12dad371"
  }
]